{
  "$schema": "./schemas/customer-content-ledger.schema.json",
  "schemaVersion": "oluk.customer-content-ledger.v1",
  "status": "PROVIDER_NEUTRAL_REFERENCE",
  "authorityPin": {
    "runtimeContractId": "OLUK_RUNTIME_CONSUMPTION_REGISTRY_V1",
    "runtimeContractVersion": "1.3.0",
    "identity": "OPTION_B_PREMIUM_LOCKED",
    "valueLaw": "NO_CUSTOMER_VALUE_WITHOUT_OWNER_APPROVAL",
    "contentStructureSourceCommit": "5cdb7fbe9e76cde2a37b890d3c3811a47364ff7a"
  },
  "routeApplicability": {
    "registryPath": "olympus:apps/olympus-shopper-ui/app/route-authority/oluk-canonical-customer-route-registry.v1.json",
    "registryCommit": "3276b667bae185ba4a09f3ac0ca31c80d9aa2b9d",
    "routeCount": 74,
    "sha256": "23dea181163af0e5f81db7580b9b59fc2762f4ea0fae1b18d144095644f33576",
    "surfaceFamilies": {
      "discovery": ["/", "/shop", "/collections/:slug", "/search", "/compare"],
      "product": ["/product/:slug", "/bundle-builder"],
      "openlab": ["/open-lab", "/open-lab/records", "/open-lab/records/:recordId", "/open-lab/compound/:slug", "/open-lab/report/:batchId"],
      "transaction": ["/bag", "/checkout/information", "/checkout/delivery", "/checkout/review"],
      "post-purchase": ["/account/orders/:orderId", "/order/success/:orderId?", "/order/tracking/:orderId"]
    }
  },
  "slotLaw": [
    {
      "slotId": "product-identity",
      "necessity": "required",
      "valueOwner": "OLUK_SEMANTIC_REGISTRY",
      "runtimeFieldRefs": ["product.canonicalProductId", "product.customerName"],
      "missingBehavior": "suppress-product-module",
      "customerLanguageLaw": "Render only canonical customer identity; operator provenance and registry state are never customer copy."
    },
    {
      "slotId": "compact-description",
      "necessity": "optional",
      "valueOwner": "OLUK_APPROVED_EDITORIAL",
      "runtimeFieldRefs": ["product.canonicalProductId"],
      "missingBehavior": "omit-slot",
      "customerLanguageLaw": "Omit the slot unless owner-approved product-specific customer wording is bound."
    },
    {
      "slotId": "decision-copy",
      "necessity": "optional",
      "valueOwner": "OLUK_APPROVED_EDITORIAL",
      "runtimeFieldRefs": ["product.canonicalProductId"],
      "missingBehavior": "omit-slot",
      "customerLanguageLaw": "Never promote candidate, proof, fixture, source, compiler, or authority language to a customer surface."
    },
    {
      "slotId": "relationship-rationale",
      "necessity": "optional",
      "valueOwner": "OLUK_RELATIONSHIP_AUTHORITY",
      "runtimeFieldRefs": ["product.canonicalProductId"],
      "missingBehavior": "omit-slot",
      "customerLanguageLaw": "Suppress the recommendation when no typed product-specific relationship and approved rationale exist."
    },
    {
      "slotId": "evidence-summary",
      "necessity": "optional",
      "valueOwner": "OPENLAB_C2",
      "runtimeFieldRefs": ["openlab.evidenceRecords[].verificationState", "openlab.evidenceRecords[].analytes[].results[].displayValue"],
      "missingBehavior": "render-locked-unavailable-state",
      "customerLanguageLaw": "Render only exact product-specific REPORTED evidence; record existence or provider state is not customer evidence copy."
    },
    {
      "slotId": "seo-description",
      "necessity": "optional",
      "valueOwner": "OLUK_APPROVED_EDITORIAL",
      "runtimeFieldRefs": ["product.canonicalProductId", "product.customerName"],
      "missingBehavior": "omit-slot",
      "customerLanguageLaw": "Do not synthesize a claim, price, stock state, or evidence statement for metadata."
    }
  ],
  "products": [
    {"canonicalProductId":"trenavar","applicableSurfaceFamilies":["discovery","product","openlab","transaction","post-purchase"],"slotStates":{"product-identity":"runtime-bound","compact-description":"candidate-only","decision-copy":"candidate-only","relationship-rationale":"unresolved","evidence-summary":"runtime-bound","seo-description":"candidate-only"},"operatorProvenance":{"identitySource":"C2 sites_product_authority_v1.json@5e5d294650c916c776afb7f4579a2023b7e3db6a","contentStructureSource":"Design content-slot structure@5cdb7fbe (structure only)","customerVisible":false}},
    {"canonicalProductId":"endurashred","applicableSurfaceFamilies":["discovery","product","openlab","transaction","post-purchase"],"slotStates":{"product-identity":"runtime-bound","compact-description":"candidate-only","decision-copy":"candidate-only","relationship-rationale":"unresolved","evidence-summary":"unresolved","seo-description":"candidate-only"},"operatorProvenance":{"identitySource":"C2 sites_product_authority_v1.json@5e5d294650c916c776afb7f4579a2023b7e3db6a","contentStructureSource":"Design content-slot structure@5cdb7fbe (structure only)","customerVisible":false}},
    {"canonicalProductId":"rad-140","applicableSurfaceFamilies":["discovery","product","openlab","transaction","post-purchase"],"slotStates":{"product-identity":"runtime-bound","compact-description":"candidate-only","decision-copy":"candidate-only","relationship-rationale":"unresolved","evidence-summary":"runtime-bound","seo-description":"candidate-only"},"operatorProvenance":{"identitySource":"C2 sites_product_authority_v1.json@5e5d294650c916c776afb7f4579a2023b7e3db6a","contentStructureSource":"Design content-slot structure@5cdb7fbe (structure only)","customerVisible":false}},
    {"canonicalProductId":"gw-501516","applicableSurfaceFamilies":["discovery","product","openlab","transaction","post-purchase"],"slotStates":{"product-identity":"runtime-bound","compact-description":"candidate-only","decision-copy":"candidate-only","relationship-rationale":"unresolved","evidence-summary":"runtime-bound","seo-description":"candidate-only"},"operatorProvenance":{"identitySource":"C2 sites_product_authority_v1.json@5e5d294650c916c776afb7f4579a2023b7e3db6a","contentStructureSource":"Design content-slot structure@5cdb7fbe (structure only)","customerVisible":false}},
    {"canonicalProductId":"s-4","applicableSurfaceFamilies":["discovery","product","openlab","transaction","post-purchase"],"slotStates":{"product-identity":"runtime-bound","compact-description":"candidate-only","decision-copy":"candidate-only","relationship-rationale":"unresolved","evidence-summary":"runtime-bound","seo-description":"candidate-only"},"operatorProvenance":{"identitySource":"C2 sites_product_authority_v1.json@5e5d294650c916c776afb7f4579a2023b7e3db6a","contentStructureSource":"Design content-slot structure@5cdb7fbe (structure only)","customerVisible":false}},
    {"canonicalProductId":"lgd-4033","applicableSurfaceFamilies":["discovery","product","openlab","transaction","post-purchase"],"slotStates":{"product-identity":"runtime-bound","compact-description":"candidate-only","decision-copy":"candidate-only","relationship-rationale":"unresolved","evidence-summary":"runtime-bound","seo-description":"candidate-only"},"operatorProvenance":{"identitySource":"C2 sites_product_authority_v1.json@5e5d294650c916c776afb7f4579a2023b7e3db6a","contentStructureSource":"Design content-slot structure@5cdb7fbe (structure only)","customerVisible":false}},
    {"canonicalProductId":"s-23","applicableSurfaceFamilies":["discovery","product","openlab","transaction","post-purchase"],"slotStates":{"product-identity":"runtime-bound","compact-description":"candidate-only","decision-copy":"candidate-only","relationship-rationale":"unresolved","evidence-summary":"runtime-bound","seo-description":"candidate-only"},"operatorProvenance":{"identitySource":"C2 sites_product_authority_v1.json@5e5d294650c916c776afb7f4579a2023b7e3db6a","contentStructureSource":"Design content-slot structure@5cdb7fbe (structure only)","customerVisible":false}},
    {"canonicalProductId":"halo","applicableSurfaceFamilies":["discovery","product","openlab","transaction","post-purchase"],"slotStates":{"product-identity":"runtime-bound","compact-description":"candidate-only","decision-copy":"candidate-only","relationship-rationale":"unresolved","evidence-summary":"unresolved","seo-description":"candidate-only"},"operatorProvenance":{"identitySource":"C2 sites_product_authority_v1.json@5e5d294650c916c776afb7f4579a2023b7e3db6a","contentStructureSource":"Design content-slot structure@5cdb7fbe (structure only)","customerVisible":false}},
    {"canonicalProductId":"mass-gh","applicableSurfaceFamilies":["discovery","product","openlab","transaction","post-purchase"],"slotStates":{"product-identity":"runtime-bound","compact-description":"candidate-only","decision-copy":"candidate-only","relationship-rationale":"unresolved","evidence-summary":"unresolved","seo-description":"candidate-only"},"operatorProvenance":{"identitySource":"C2 sites_product_authority_v1.json@5e5d294650c916c776afb7f4579a2023b7e3db6a","contentStructureSource":"Design content-slot structure@5cdb7fbe (structure only)","customerVisible":false}},
    {"canonicalProductId":"yk-11","applicableSurfaceFamilies":["discovery","product","openlab","transaction","post-purchase"],"slotStates":{"product-identity":"runtime-bound","compact-description":"candidate-only","decision-copy":"candidate-only","relationship-rationale":"unresolved","evidence-summary":"runtime-bound","seo-description":"candidate-only"},"operatorProvenance":{"identitySource":"C2 sites_product_authority_v1.json@5e5d294650c916c776afb7f4579a2023b7e3db6a","contentStructureSource":"Design content-slot structure@5cdb7fbe (structure only)","customerVisible":false}},